rank	total_score	price_eur	motor	condition	source	title	url	description	price_score	motor_score	value_score	source_score
1	90.0	1.0	Bosch	used	Kleinanzeigen	Suche E-Bike Unfallrad mit Bosch Motor	https://www.kleinanzeigen.de/s-anzeige/suche-e-bike-unfallrad-mit-bosch-motor/3190907748-217-2025	suche defekte ebike oder unfallrad mit Bosch Mittel-Motoren.	40.0	30	10	10
2	89.8	10.0	Bosch	used	Kleinanzeigen	Suche E-Bikes (auch defekt) – Bosch Motor bevorzugt	https://www.kleinanzeigen.de/s-anzeige/suche-e-bikes-auch-defekt-bosch-motor-bevorzugt/3359304820-217-8728	"Ich kaufe Elektrofahrräder, vorzugsweise mit Bosch-Motor.

Auch defekte E-Bikes oder Fahrräder mit..."	39.8	30	10	10
3	89.3	45.0	Bosch	used	Kleinanzeigen	SUCHE | E-Bike Bosch Akku PowerPack 300 400 500 defekt!	https://www.kleinanzeigen.de/s-anzeige/suche-e-bike-bosch-akku-powerpack-300-400-500-defekt-/3360147598-217-3340	"Hallo Leute, ich benötige Bosch PowerPacks als Ersatzteilspender.

hier mal die aktuelle Ankauf -..."	39.3	30	10	10
4	87.6	150.0	Bosch	used	Kleinanzeigen	Suche E Bike Bosch Nyon 1 oder 2	https://www.kleinanzeigen.de/s-anzeige/suche-e-bike-bosch-nyon-1-oder-2/3283971131-230-8337	"Hallo zusammen,
ich suche Bosch Nyon 1 oder 2 komplett."	37.6	30	10	10
5	83.6	400.0	Bosch	used	Kleinanzeigen	SUCHE E-Bike Bosch Defekt Performance Herren Uni-sex 27,5“ 28“	https://www.kleinanzeigen.de/s-anzeige/suche-e-bike-bosch-defekt-performance-herren-uni-sex-27-5-28-/3347305489-217-1516	"Hallo!
Ich suche auf diesem Weg ein E-Bike mit Antrieb von Bosch.
Am liebsten ein Herren- oder..."	33.6	30	10	10
